id,original,lexical,syntactic,contextual,Question_ECS
1,"For every 12 cans you recycle, you receive $0.50, and for every 5 kilograms of newspapers, you receive $1.50. If your family collected 144 cans and 20 kilograms of newspapers, how much money would you receive?","You earn $0.50 for each 12 cans recycled, and $1.50 for every 5 kilograms of newspapers. If your family gathered 144 cans and 20 kilograms of newspapers, how much money will you earn?","If your family collected 144 cans and 20 kilograms of newspapers, and you get $0.50 for every 12 cans and $1.50 for every 5 kilograms of newspapers, what total amount would you receive?","At a community recycling drive, you get $0.50 for every 12 cans and $1.50 for each 5 kilograms of newspapers. If your family turned in 144 cans and 20 kilograms of newspapers, how much would you make?",0.9129705429077148
2,Betty picked 16 strawberries. Matthew picked 20 more strawberries than Betty and twice as many as Natalie. They used their strawberries to make jam. One jar of jam used 7 strawberries and they sold each jar at $4. How much money were they able to make from the strawberries they picked?,"Betty gathered 16 strawberries. Matthew collected 20 more than Betty and twice as many as Natalie. Using their strawberries, they made jam. Each jar required 7 strawberries and sold for $4. How much money did they make from their strawberries?","Using their strawberries to make jam, they sold each $4 jar that required 7 strawberries. Betty had picked 16 strawberries, while Matthew gathered 20 more than Betty and twice what Natalie picked. How much did they earn?","During a sunny afternoon, Betty picked 16 strawberries. Matthew picked 20 more than Betty and twice as many as Natalie. They turned their harvest into jam, selling each $4 jar made from 7 strawberries. How much did they earn?",0.956508735815684
3,"Jack has a stack of books that is 12 inches thick. He knows from experience that 80 pages is one inch thick. If he has 6 books, how many pages is each one on average?","Jack’s pile of books measures 12 inches in thickness. From experience, he knows that every inch equals 80 pages. Given that he owns 6 books, what’s the average number of pages per book?","If Jack owns 6 books and the total stack measures 12 inches thick, and he knows that 1 inch equals 80 pages, how many pages does each book have on average?","On his study desk, Jack’s 6 books form a stack that is 12 inches tall. Since he knows 1 inch equals 80 pages, what is the average number of pages in each book?",0.9426932434240977
4,"James dumps his whole collection of 500 Legos on the floor and starts building a castle out of them. He uses half the pieces before finishing and is told to put the rest away. He puts all of the leftover pieces back in the box they came from, except for 5 missing pieces that he can't find. How many Legos are in the box at the end?","James pours out his collection of 500 Legos and begins constructing a castle. He uses half the pieces, then is told to clean up. He returns all remaining pieces to the box except for 5 that are missing. How many Legos end up in the box?","After being told to clean up, James puts away all leftover Legos except for 5 lost ones. Earlier, he had dumped 500 Legos to build a castle and used half. How many Legos does he have in the box now?","On a rainy afternoon, James spills out 500 Legos to build a castle. He uses half, then puts the remaining ones back in the box—except for 5 that went missing. How many Legos are now in the box?",0.9244817495346069
5,"Ines had $20 in her purse. She bought 3 pounds of peaches, which are $2 per pound at the local farmers’ market. How much did she have left?",Ines carried $20 in her purse. She purchased 3 pounds of peaches at $2 per pound. How much money remained after her purchase?,"After buying 3 pounds of peaches for $2 per pound at the local market, how much of her original $20 does Ines have left?","At a Saturday farmers’ market, Ines had $20 in her purse. She bought 3 pounds of peaches for $2 each pound. How much money did she have remaining?",0.8867500027020773
6,"Aaron pays his actuary membership fees each year. The membership fee increases yearly by $10. If he pays $80 in the first year, how much does his membership cost, in dollars, in the sixth year?","Aaron pays annual dues for his actuary membership. Each year, the fee goes up by $10. If the first year’s fee is $80, what will it cost him in the sixth year?","If Aaron’s actuary membership fee starts at $80 and rises by $10 each year, what will the cost be in the sixth year?","For his professional association, Aaron pays an annual fee starting at $80 and rising by $10 per year. How much does he owe in the sixth year?",0.8547397156556448
7,"Joseph invested $1000 into a hedge fund. The fund promised a yearly interest rate of 10%. If he deposited an additional $100 every month into the account to add to his initial investment of $1000, how much money will he have in the fund after two years?","Joseph put $1000 into a hedge fund that offers 10% yearly interest. He also adds $100 each month to his investment. After two years, how much money will he have in total?","If Joseph invests $1000 initially in a hedge fund with a 10% annual interest rate and adds $100 each month, how much will the fund contain after two years?","At the start of the year, Joseph places $1000 in a hedge fund yielding 10% yearly interest. By contributing $100 monthly, how much will he have after two years?",0.938127597173055
8,"The price of buying a wooden toy at the new Craftee And Best store is $20, and the cost of buying a hat is $10. If Kendra went to the shop with a $100 bill and bought two wooden toys and three hats, calculate the change she received.","At Craftee And Best, wooden toys cost $20 each and hats cost $10 each. Kendra brought a $100 bill and bought two toys and three hats. How much change did she get?","Kendra brought $100 to Craftee And Best, where hats cost $10 and wooden toys cost $20. After buying two toys and three hats, what was her change?","At the downtown Craftee And Best store, Kendra had $100. She purchased two wooden toys at $20 each and three hats at $10 each. How much change did she receive?",0.865275094906489
9,"James is trying to create a new breed of kittens with extra-long tails. Each generation of kittens he breeds has a tail 25% longer than the last generation. If the first generation has tails 16 cm long, how long are the third generation's tails?","James is breeding kittens that have increasingly long tails. Every new generation’s tails are 25% longer than the previous one. If the first generation’s tails measure 16 cm, how long are those of the third generation?","If the first generation of kittens has 16 cm tails and each following generation’s tails are 25% longer than the one before, how long are the tails in the third generation James breeds?","In his animal lab, James breeds kittens with longer tails each generation. Starting with 16 cm tails and increasing by 25% per generation, how long are the third generation’s tails?",0.9258450071016947
10,"The Rotary Club is holding its annual fundraising Omelet Breakfast, with tickets sold in advance. The tickets come in different price levels, for young children, older children, adults, and seniors. This year they sold 53 small children tickets, 35 older children tickets, 75 adult tickets, and 37 senior tickets. To figure out how many eggs they need to buy, the club estimates that small children can eat a half omelet, older children can eat a whole omelet, adults will eat two omelets, and seniors will eat one and a half omelets. Just to be on the safe side, they get enough eggs to make 25 extra omelets. If they use 2 eggs for each omelet, how many eggs will they need to buy?","At its annual Omelet Breakfast fundraiser, the Rotary Club pre-sells tickets for small children, older children, adults, and seniors. They sold 53 small children tickets, 35 older children tickets, 75 adult tickets, and 37 senior tickets. Assuming small children eat half an omelet, older children one, adults two, and seniors one and a half, and adding enough eggs for 25 extra omelets, how many eggs do they need if each omelet uses 2 eggs?","To prepare for their annual Omelet Breakfast fundraiser, the Rotary Club sold 53 small children tickets, 35 older children tickets, 75 adult tickets, and 37 senior tickets. If each small child eats half an omelet, each older child one, each adult two, and each senior one and a half, plus 25 extra omelets for safety, and each omelet takes 2 eggs, how many eggs should they buy?","During the Rotary Club’s yearly fundraising breakfast, they expect guests based on 53 small children, 35 older children, 75 adults, and 37 seniors. Small children eat half an omelet, older kids one, adults two, seniors one and a half. They’ll also plan for 25 extra omelets. Using 2 eggs per omelet, how many eggs do they need to purchase?",0.945702850818634
11,John buys cans of soup for buy 1 get one free. He gets 30 cans with a normal price of $0.60. How much does he pay?,"John purchases soup cans on a buy-one-get-one-free offer. The regular price per can is $0.60, and he ends up with 30 cans. How much does he spend?","If John gets 30 cans of soup during a buy-one-get-one-free sale where each can normally costs $0.60, how much does he pay?","At a local grocery store, John takes advantage of a buy-one-get-one-free deal on soup. The usual price is $0.60 per can, and he picks up 30 cans. How much does he pay?",0.9255731304486593
12,"Michael has 36 pets. 25% of them are dogs, 50% are cats, and the rest are bunnies. How many bunnies does he have?","Michael owns 36 pets in total. Of these, 25% are dogs and 50% are cats. The remainder are bunnies. How many bunnies does Michael have?","If Michael has 36 pets, with 25% being dogs and 50% being cats, how many of his pets are bunnies?","At home, Michael takes care of 36 pets. A quarter of them are dogs and half are cats, while the rest are bunnies. How many bunnies does he have?",0.9106309314568838
13,"Grant has four times as many vacations as Kelvin has classes. If Kelvin has 90 classes, how many vacations and classes do Grant and Kelvin have altogether?","Grant’s number of vacations is four times the number of classes Kelvin takes. Given that Kelvin has 90 classes, how many total vacations and classes do they have combined?","If Kelvin has 90 classes and Grant has four times that number in vacations, what is the total number of vacations and classes they have together?","During the school year, Kelvin has 90 classes while Grant has four times as many vacations. What’s the total number of vacations and classes they have between them?",0.9289263784885406
14,"Julie is making caesar salad for a family picnic. At the market, she spends $8 on green lettuce and $6 on red lettuce. If each type of lettuce costs $2 per pound, how many total pounds of lettuce did she buy?","Julie is preparing a caesar salad for a picnic. She paid $8 for green lettuce and $6 for red lettuce. Since both cost $2 per pound, how many pounds of lettuce did she purchase in total?","If Julie spends $8 on green lettuce and $6 on red lettuce, both priced at $2 per pound, how many pounds of lettuce did she buy for her family picnic?","At the farmers' market, Julie buys lettuce for a family picnic. She spends $8 on green lettuce and $6 on red lettuce, each costing $2 per pound. How many pounds of lettuce did she get?",0.9236719111601511
15,"Jimmy bought 3 pens for school for $1 each, 4 notebooks for $3 each and 2 folders for $5 each. If he paid with a $50 bill, how much change will he get back?","Jimmy purchased 3 pens at $1 each, 4 notebooks at $3 each, and 2 folders at $5 each. Paying with a $50 bill, how much change does he receive?","If Jimmy buys 3 pens for $1 each, 4 notebooks for $3 each, and 2 folders for $5 each, and pays with $50, how much change will he get?","For his new semester, Jimmy buys 3 pens at $1 each, 4 notebooks at $3 each, and 2 folders at $5 each. He pays with a $50 bill. What change does he receive?",0.940385639667511
16,Fern buys one pair of high heels for $60 and five pairs of ballet slippers for 2/3rds of the price of the high heels. How much does she pay total?,"Fern purchases a pair of high heels for $60 and five pairs of ballet slippers, each costing two-thirds of the price of the heels. What is her total cost?","If the high heels cost $60 and each of the five pairs of ballet slippers costs two-thirds as much, how much does Fern pay altogether?","While shopping at the mall, Fern spends $60 on high heels and buys five pairs of ballet slippers priced at two-thirds that amount each. What is the total cost?",0.9334205587704977
17,"The teacher divided the students into four groups. One group had 5 students, another 8 students, and the third 7 students. If there were 24 total students, how many students were in the fourth group?","A teacher split a class of 24 students into four groups. Three of the groups had 5, 8, and 7 students respectively. How many students were in the remaining group?","If a teacher divides 24 students into four groups, with three groups having 5, 8, and 7 students, how many students are in the fourth group?","In a classroom activity, a teacher organizes 24 students into four groups. The first three groups have 5, 8, and 7 students. How many students are in the last group?",0.9167912105719248
18,"Every hour past noon shadows from a building stretch an extra 5 feet, starting at zero at noon. How long are the shadows from the building 6 hours past noon in inches?","Each hour after noon, a building’s shadow becomes 5 feet longer, beginning at zero length at noon. What is the shadow’s length in inches after 6 hours?","If the building’s shadow starts at 0 feet at noon and grows 5 feet longer every hour, how many inches long is it 6 hours later?","On a sunny day, a building’s shadow grows by 5 feet each hour after noon, starting from zero at noon. How long is the shadow in inches 6 hours after noon?",0.9263796309630076
19,"A fox can run at the maximum speed of 50 kilometers per hour. Considering the fox would run at a constant speed, what distance would he make during 120 minutes?",A fox runs at a steady top speed of 50 kilometers per hour. How far does it travel in 120 minutes if it maintains this speed?,"If a fox maintains a constant speed of 50 kilometers per hour, what distance does it cover in 120 minutes?","While chasing prey, a fox maintains a speed of 50 kilometers per hour. After running for 120 minutes, how far has it traveled?",0.9066075384616852
20,"There were 40 kids on Lake Pleasant. A fourth of the kids went tubing, but only half of the tubers went rafting. How many of the kids who joined the rafting excursion were also on the tubing excursion?","Out of 40 kids at Lake Pleasant, one-fourth went tubing, and only half of those went rafting as well. How many kids participated in both tubing and rafting?","If 40 kids are on Lake Pleasant and a fourth go tubing, and half of those tubers also go rafting, how many joined both activities?","On a summer trip to Lake Pleasant, 40 kids take part in water activities. A fourth go tubing, and half of the tubers also go rafting. How many kids did both?",0.8933874865372976
21,"At a convention, 16 of 36 delegates arrived with pre-printed name badges. Half of the remaining delegates made their own, hand-written name badges. How many delegates were not wearing name badges?","At a conference, 16 out of 36 delegates brought pre-made name badges. Half of the rest created their own by hand. How many delegates didn’t have a name badge at all?","If 16 of the 36 delegates at a convention have pre-printed badges, and half of the others make hand-written ones, how many delegates end up without any name badge?","During a large business convention, 16 of the 36 attendees showed up with pre-printed name badges. Half of the remaining attendees made their own hand-written ones. How many people had no name badge?",0.8536182741324106
22,"Edward the plumber is replacing a pipe in a bathroom wall. He needs to use 40 feet of copper pipe to complete the job. For every 5 feet of pipe, Edward must use one tightening bolt, and for every bolt, he uses two washers. He buys a bag of 20 washers for the job. After he completes the bathroom job, how many washers will be remaining in the bag?","Edward, a plumber, is installing a 40-foot copper pipe in a bathroom wall. He needs one bolt for every 5 feet of pipe and two washers for each bolt. He purchases a pack of 20 washers. When he finishes, how many washers are left?","If Edward uses 40 feet of copper pipe, needing one bolt per 5 feet and two washers per bolt, and he starts with 20 washers, how many will remain after the job?","While fixing a bathroom pipe, Edward the plumber uses 40 feet of copper piping. For every 5 feet, he attaches one bolt, and each bolt requires two washers. He begins with 20 washers. After finishing, how many are left in the bag?",0.9070732394854227
23,Eric has 4 ninja throwing stars. His friend Chad has twice as many. Then Jeff bought 2 ninja stars from Chad. Jeff now has 6 throwing stars. How many ninja throwing stars do they have altogether?,"Eric owns 4 ninja stars, and Chad has double that number. After Jeff buys 2 stars from Chad, Jeff ends up with 6. How many ninja stars do Eric, Chad, and Jeff have in total?","If Eric has 4 ninja stars, Chad has twice as many, and Jeff purchases 2 from Chad to end up with 6, what is their total number of stars combined?","During martial arts practice, Eric has 4 ninja stars, Chad has twice that number, and Jeff buys 2 from Chad, ending up with 6 stars. How many stars do the three friends have altogether?",0.886985202630361
24,Each dandelion produces 300 seeds. 1/3rd of the seeds land in water and die. 1/6 of the starting number are eaten by insects. Half the remainder sprout and are immediately eaten. How many dandelions survive long enough to flower?,"A single dandelion generates 300 seeds. One-third fall into water and die, one-sixth are eaten by insects, and half of what remains sprout only to be eaten right away. How many manage to survive to bloom?","If each dandelion produces 300 seeds, with one-third dying in water, one-sixth eaten by insects, and half of the rest eaten after sprouting, how many survive to flower?","In a sunny field, each dandelion produces 300 seeds. A third fall into water and die, a sixth are eaten by bugs, and half of the rest sprout but get eaten. How many dandelions survive to bloom?",0.9078380763530731
25,"By the time Anne is two times as old as Emile, Emile will be six times as old as Maude. If Maude will be 8 years old, how old will Anne be?","When Anne’s age is double Emile’s, Emile’s age will be six times Maude’s. If Maude is 8 years old, how old is Anne at that time?","If Maude will be 8 years old and Emile will then be six times her age, while Anne will be twice Emile’s age, how old will Anne be?","In a few years, Maude will be 8 years old. At that time, Emile will be six times her age, and Anne will be twice as old as Emile. How old will Anne be?",0.9640653729438782
26,Mason is mixing up some salad dressing. He takes a bowl that holds 150 ml and fills it 2/3rds with oil and 1/3rd with vinegar. The oil weighs 5 g/ml and the vinegar weighs 4 g/ml. How many grams does the salad dressing weigh?,"Mason prepares salad dressing in a 150 ml bowl, filling two-thirds with oil and one-third with vinegar. Oil weighs 5 g/ml and vinegar weighs 4 g/ml. What is the total weight of the dressing?","If Mason fills a 150 ml bowl two-thirds full of oil weighing 5 g/ml and one-third full of vinegar weighing 4 g/ml, how many grams does the dressing weigh?","In his kitchen, Mason mixes salad dressing using a 150 ml bowl filled two-thirds with oil and one-third with vinegar. Oil has a weight of 5 g/ml, and vinegar 4 g/ml. How heavy is the mixture?",0.9101435840129852
27,TreShawn's mom needs to order pizza for her son and his two friends. She knows that TreShawn always eats 1/2 a pizza. His friend Michael eats 1/3 of a pizza and his other friend LaMar eats 1/6 of a pizza. How many pizzas does she need to order?,"TreShawn’s mother plans to order pizza for him and two of his friends. TreShawn eats half a pizza, Michael eats one-third, and LaMar eats one-sixth. How many pizzas should she order?","If TreShawn eats 1/2 of a pizza, Michael eats 1/3, and LaMar eats 1/6, how many pizzas should TreShawn’s mom order for all three of them?","At her son’s sleepover, TreShawn’s mom orders pizza. TreShawn eats 1/2, Michael eats 1/3, and LaMar eats 1/6 of a pizza. How many pizzas does she need in total?",0.9184047182401022
28,"Out of the 200 apples in an orchard, 40 percent were rotten. Also, 70 percent of the rotten apples smelled. How many rotten apples in the orchard did not smell?","In an orchard of 200 apples, 40% turned out to be rotten, and 70% of those rotten ones gave off a smell. How many rotten apples didn’t smell?","If there are 200 apples in total, with 40% rotten and 70% of those rotten ones smelling, how many rotten apples do not smell?","At a small orchard, there are 200 apples. 40% are rotten, and of those, 70% have a bad smell. How many rotten apples don’t smell at all?",0.9093929827213287
29,Tom and Elizabeth have a competition to climb a hill. Elizabeth takes 30 minutes to climb the hill. Tom takes four times as long as Elizabeth does to climb the hill. How many hours does it take Tom to climb up the hill?,"Elizabeth climbs a hill in 30 minutes, while Tom takes four times as long. How many hours does it take Tom to reach the top?","If Elizabeth takes 30 minutes to climb a hill and Tom takes four times her time, how long in hours does Tom take?","During a friendly race, Elizabeth climbs a hill in 30 minutes. Tom takes four times her time. How many hours does Tom spend climbing?",0.9027105271816254
30,"Barry stands on his head for 10 minutes at a time, but then he must sit for 5 minutes before he can take another turn standing on his head. How many turns can Barry take standing on his head during a single 2-hour period?","Barry can balance on his head for 10 minutes before resting for 5 minutes. In a 2-hour stretch, how many times can he do a headstand?","If Barry alternates between 10 minutes standing on his head and 5 minutes resting, how many headstands can he complete in 2 hours?","During a practice session lasting 2 hours, Barry performs headstands lasting 10 minutes each, with a 5-minute rest between turns. How many headstands can he take?",0.8638337850570679
31,"A few friends are making a small movie. They hire a few actors and that cost $1200. They also get food for the 50 people there. Each person gets $3 worth of food. Equipment rental costs twice as much as food and actors combined. They sold the movie for $10,000. How much profit did they make?","Some friends are producing a short film. They spend $1200 on hiring actors and buy $3 worth of food per person for 50 people. The equipment rental is twice the total cost of the food and actors. After selling the movie for $10,000, how much profit did they earn?","If a group of friends spends $1200 on actors and $3 per person for food for 50 people, and the equipment rental costs twice as much as both of those combined, then sells the movie for $10,000, what is their profit?","During a weekend film project, a group of friends pays $1200 for actors and buys $3 of food for each of the 50 crew members. Equipment rental costs twice as much as the combined cost of actors and food. After selling the film for $10,000, how much profit do they make?",0.9105626344680786
32,Cristine bought a dozen lemons and gave 1/4 of them to her neighbor. How many lemons does Cristine have left?,Cristine purchased 12 lemons and gave a quarter of them to her neighbor. How many lemons remain with her?,"If Cristine starts with a dozen lemons and gives 1/4 to her neighbor, how many does she keep?","At the farmers’ market, Cristine buys a dozen lemons and decides to give a fourth of them to her neighbor. How many lemons does she still have?",0.9063784976800283
33,"Giselle had 20 female doves in a birdhouse. After a month, the doves laid 3 eggs each. If 3/4 of the eggs hatched, calculate the total number of doves Giselle has now.","Giselle kept 20 female doves. Each laid 3 eggs in a month, and 3/4 of those eggs hatched. How many doves does she have in total now?","If 20 female doves each lay 3 eggs and 3/4 of all eggs hatch, how many doves does Giselle have altogether after a month?","In her backyard birdhouse, Giselle has 20 female doves. After a month, each lays 3 eggs, and 3/4 of the eggs hatch successfully. What’s the total number of doves now?",0.927775502204895
34,Macey saves to buy herself a shirt that costs $3. She was able to save $1.50 already. How many weeks does she need to save for the remaining amount if she saves $0.50 per week?,"Macey is saving to buy a $3 shirt. She’s already saved $1.50. If she saves $0.50 each week, how many more weeks will it take her?","If Macey has already saved $1.50 toward a $3 shirt and continues to save $0.50 weekly, how many weeks will she need to finish saving?",Macey wants to buy a $3 shirt. She’s saved $1.50 so far and plans to save $0.50 every week. After how many weeks will she have enough money?,0.9152071277300516
