id,original,lexical,syntactic,contextual,Question_ECS
229,"At Mario's barbershop haircuts are 50% more expensive during the weekends. If Mario paid $18 for his last haircut on Monday, how much he would have paid the day before?","Haircuts at Mario’s barbershop cost 50% more on weekends. If Mario’s Monday haircut was $18, what would it have cost on Sunday?","If weekday haircuts cost $18 and weekend prices are 50% higher, how much would Mario’s haircut have cost the previous day?","At his usual barbershop, Mario pays $18 for a Monday haircut. Since weekend cuts are 50% pricier, what would his Sunday haircut have cost?",0.924235333998998
230,"The age difference between Asaf and Alexander's age is half the total number of pencils Asaf has. The sum of their ages is 140, and Asaf is 50 years old. If Alexander has 60 more pencils than Asaf, calculate the total number of pencils they have together.","Asaf is 50 years old, and the sum of his and Alexander’s ages is 140. The difference in their ages equals half of Asaf’s pencil count. If Alexander owns 60 more pencils than Asaf, how many pencils do they have in total?","If Asaf’s age is 50 and together with Alexander their ages total 140, with their age gap being half Asaf’s pencil count, and Alexander having 60 more pencils than him, what’s the total number of pencils they own?","During math class, Asaf (age 50) and Alexander (combined age 140) compare pencils. The age gap equals half of Asaf’s pencil count, and Alexander has 60 more pencils. How many pencils do they share in total?",0.8941173255443573
231,Jean has 60 stuffies. She keeps 1/3 of them and then gives away the rest. She gives 1/4 of what she gave away to her sister Janet. How many stuffies did Janet get?,Jean owns 60 stuffed animals. She keeps one-third of them and gives away the rest. One-fourth of those she gave away went to her sister Janet. How many did Janet receive?,"If Jean starts with 60 stuffies, keeps 1/3, and gives away the remaining ones—1/4 of which go to Janet—how many does Janet get?","At her birthday cleanup, Jean has 60 stuffed animals. After keeping 1/3, she donates the rest and gives 1/4 of the donated ones to her sister Janet. How many did Janet receive?",0.8727893233299255
232,"After Betty gave Stuart 40% of her marble collection, the number of marbles in Stuart's collection increased to 80. If Betty had 60 marbles, how many marbles did Stuart have initially?","Betty gave Stuart 40% of her 60 marbles, making his total reach 80 marbles. How many marbles did Stuart originally have?","If Betty had 60 marbles and gave 40% of them to Stuart, whose collection then totaled 80, how many marbles did Stuart have before receiving any?","While trading marbles, Betty gave Stuart 40% of her 60 marbles, bringing his total to 80. How many marbles did Stuart start with?",0.9365449249744415
233,"The tallest building in the world is 100 feet tall. If the second tallest is half that tall, and the third tallest is half as tall as the second, and the fourth is one-fifth as tall as the third, how tall are all 4 buildings put together?","The tallest building measures 100 feet. The second one is half as high, the third half of the second, and the fourth one-fifth the height of the third. What is the combined height of all four buildings?","If the tallest building is 100 feet, the next is half that height, the third half the second, and the fourth one-fifth of the third, what’s the total height of the four together?","In a city skyline, the tallest building stands at 100 feet. The next is half as tall, the third half of that, and the fourth one-fifth as tall as the third. What’s their total height?",0.8828924894332886
234,John buys 5 toys that each cost $3. He gets a 20% discount. How much did he pay for everything?,John purchases 5 toys priced at $3 each and receives a 20% discount. How much does he pay in total?,"If each of John’s 5 toys costs $3 and he receives a 20% discount on the total, what is his final payment?","At a toy store sale, John buys 5 toys for $3 each and gets a 20% discount. How much money does he spend in total?",0.9366460740566254
235,Lee is saving up for a new pair of sneakers which cost $90. He already has $15 saved. He plans to sell his old action figures to make the rest. If he sells 10 action figures and still has $25 left after buying the sneakers how much did he charge per action figure?,"Lee wants to buy sneakers worth $90. He has $15 saved and sells 10 old action figures to afford them. After purchasing the sneakers, he still has $25. What price did he sell each figure for?","If sneakers cost $90, Lee has $15 saved, and after selling 10 figures he still has $25 left, what was the selling price per figure?","While cleaning his room, Lee decides to sell 10 action figures to buy $90 sneakers. With $15 already saved and $25 left after purchase, how much was each figure sold for?",0.9045453568299612
236,The chocolate factory produces 50 candies per hour. It has to fulfill an order and produce 4000 candies. How many days will it take to complete the order if the factory works for 10 hours every day?,"A chocolate factory makes 50 candies each hour and must produce 4000 candies. If it operates 10 hours daily, how many days are needed to finish the order?","If the factory produces 50 candies per hour and works 10 hours daily, how many days will it take to make 4000 candies?","At a small candy factory, 50 candies are made every hour. The factory runs 10 hours a day and needs to make 4000 candies. How many days will that take?",0.912803441286087
237,"A club with 30 members ordered fruit juices. Two-fifths of them ordered lemon juice. One-third of the remaining members ordered mango juice, and the rest ordered orange juice. How many members ordered orange juice?","Out of 30 club members, two-fifths chose lemon juice, one-third of the rest picked mango juice, and the remainder went for orange juice. How many chose orange?","If 30 members order fruit juice, two-fifths get lemon, one-third of the remaining choose mango, and the rest order orange, how many got orange juice?","At a club meeting with 30 members, some ordered lemon, mango, or orange juice. Two-fifths got lemon, one-third of the rest got mango. How many had orange juice?",0.9056399663289388
238,"Emily spent X dollars on Friday, twice that amount on Saturday, and then three times X on Sunday. Over the three days, she spent $120. What is the value of X, in dollars?","Emily spends X dollars on Friday, double that on Saturday, and triple X on Sunday. Her total spending for the three days is $120. What is X?","If Emily spends X on Friday, 2X on Saturday, and 3X on Sunday, totaling $120, what is the value of X?","During a shopping weekend, Emily spends X on Friday, twice that on Saturday, and three times X on Sunday. Her total bill is $120. What is X?",0.9156801104545593
239,Bobby can deadlift 300 pounds at 13. When he is 18 he can deadlift 100 pounds more than 250% of his previous deadlift. How many pounds did he add per year?,"At age 13, Bobby can deadlift 300 pounds. By age 18, his lift is 100 pounds more than 250% of that amount. How many pounds did he increase per year?","If Bobby’s deadlift at 13 is 300 pounds and at 18 is 100 pounds greater than 250% of that, how much does his lift improve annually?","In his gym progress journal, Bobby notes he lifted 300 pounds at 13. At 18, he could lift 100 pounds more than 250% of that. How many pounds did he add each year?",0.885017454624176
240,"Monica was saving money for her future. Every week he put $15 into her moneybox. After the moneybox got full, which took 60 weeks, Monica took all the money out and took it to the bank, and she started saving money again. She repeated this whole process 5 times. How much money did Monica take to the bank in total?","Monica saved $15 every week. It took 60 weeks to fill her moneybox, after which she deposited it in the bank and restarted the process. She did this 5 times. What was her total deposit?","If Monica puts $15 into her moneybox weekly, fills it in 60 weeks, and repeats this 5 times, how much money does she deposit in total?","For her long-term savings goal, Monica adds $15 per week to a box. Every 60 weeks it fills up, so she deposits it and starts again, doing this 5 times. What’s her total bank deposit?",0.8723963797092438
241,Kim buys 3 pizzas. They are 12 slices each. The pizza cost $72. How much did 5 slices cost?,"Kim purchases 3 pizzas, each cut into 12 slices. The total price is $72. What is the cost of 5 slices?","If 3 pizzas cost $72 and each pizza has 12 slices, how much would 5 slices cost?","At a local restaurant, Kim orders 3 pizzas, each with 12 slices, for a total of $72. How much would 5 slices cost her?",0.9194706479708353
242,Mary has 300 sheep and Bob has double the number of sheep as Mary plus another 35. How many sheep must Mary buy to have 69 fewer sheep than Bob?,Mary owns 300 sheep. Bob has twice as many sheep as Mary plus 35 more. How many sheep does Mary need to buy so she has 69 fewer than Bob?,"If Mary starts with 300 sheep and Bob has double that number plus 35, how many sheep must Mary purchase to end up with 69 fewer than Bob?","On her farm, Mary keeps 300 sheep. Bob has double that plus 35. How many more sheep should Mary buy to have 69 fewer than Bob?",0.9517617424329122
243,"James visits 20 houses to try and make a sale. He manages to sell something in every house. The next day he visits twice as many houses but only sold to 80% of houses. If he sold two things at each house in each of the two days, how many items did he sell?","James goes to 20 houses on the first day and makes sales at each one. On the following day, he visits twice as many homes and sells at 80% of them. If he sells 2 items at every house he sells to, how many total items did he sell?","If James sells 2 items per house, visits 20 homes the first day selling at all, and the next day visits double that but sells to 80% of them, how many items does he sell in total?","While working as a door-to-door salesman, James visits 20 homes one day and twice as many the next. He sells 2 items at each successful house. On the second day, only 80% of homes buy from him. How many items did he sell overall?",0.9304757217566172
244,"The bakery made 95 muffins. They will be packed in boxes with 5 muffins in each box. If there are only 10 available boxes, how many boxes do they still need to pack all the muffins?","A bakery bakes 95 muffins, packing 5 muffins per box. With only 10 boxes available, how many additional boxes are needed to pack everything?","If 95 muffins are packed in boxes holding 5 each, and there are 10 boxes ready, how many more boxes are required?","At the local bakery, 95 muffins are baked and placed 5 per box. If only 10 boxes are available, how many extra boxes are needed to pack all muffins?",0.9380207260449728
245,"Dale owns 4 sports cars. The red one can travel at twice the speed of the green one, but the green one can travel at 8 times the speed of the blue one. The yellow one is broken and cannot move at all. If the blue one can travel at a speed of 80 miles per hour, at what speed, in miles per hour, can the red car travel?","Dale has 4 sports cars. The red car is twice as fast as the green car, the green car is 8 times faster than the blue one, and the yellow car doesn’t work. If the blue car goes 80 mph, how fast can the red one go?","If the blue car travels 80 mph, the green one goes 8 times that, and the red car is twice the green car’s speed, what’s the red car’s speed in mph?","At his weekend car show, Dale compares his 4 cars: the red, green, blue, and broken yellow one. The blue drives 80 mph, the green 8× that, and the red is twice the green’s speed. How fast is the red car?",0.8453721106052399
246,"Tom split 2 apples into 8 slices each. Tom gave 3/8ths of the apple slices to his friend Jerry, then ate half of the remaining slices. How many apple slices does Tom have left?",Tom cuts 2 apples into 8 slices each. He gives Jerry 3/8 of all the slices and eats half of what remains. How many slices are left with Tom?,"If Tom slices 2 apples into 8 pieces each, gives away 3/8 of them to Jerry, and eats half of what’s left, how many slices remain?","At lunchtime, Tom cuts 2 apples into 8 slices each. He gives 3/8 of them to Jerry and eats half of what’s left. How many slices are still with him?",0.9390351970990499
247,"Fabian is shopping at a nearby supermarket. He wants to buy 5 kilograms of apples, 3 packs of sugar, and 500 grams of walnuts. One kilogram of apples costs $2, and one kilogram of walnuts costs $6. One pack of sugar is $1 cheaper than one kilogram of apples. How much Fabian needs to pay for the items he wants to buy?","Fabian goes shopping to buy 5 kg of apples, 3 packs of sugar, and 500 g of walnuts. Apples cost $2 per kg, walnuts $6 per kg, and each sugar pack is $1 cheaper than a kilogram of apples. What’s the total cost?","If Fabian buys 5 kg of apples at $2/kg, 500 g of walnuts at $6/kg, and 3 packs of sugar each $1 cheaper than apples, how much does he pay in total?","During his grocery trip, Fabian purchases 5 kg of apples, 3 sugar packs, and 500 g of walnuts. Apples cost $2/kg, walnuts $6/kg, and sugar $1 less than apples. What’s the total he spends?",0.9091293513774872
248,"Stacy was 50 inches tall last year. If she grew 6 inches more than her brother who grew 1 inch last year, how tall is Stacy now?","Last year, Stacy was 50 inches tall. She grew 6 inches more than her brother, who grew 1 inch. What is Stacy’s current height?","If Stacy’s height last year was 50 inches, and she grew 6 inches more than her brother (who grew 1 inch), what’s her height now?","At her annual check-up, Stacy measures her new height. Last year she was 50 inches tall and grew 6 inches more than her brother, who grew 1 inch. How tall is she now?",0.9525136947631836
249,"While preparing for a meeting, Bill fills Dixie cups with water from out of a water cooler. The water cooler initially contains 3 gallons of water, and each Dixie cup holds 6 ounces of water. If Bill fills one cup of water per each meeting chair, and there are 5 rows of meeting chairs with 10 chairs in each row, then how many ounces of water will be left in the cooler after all cups have been are filled? (There are 128 ounces in a gallon.)","Bill fills small cups from a water cooler before a meeting. The cooler starts with 3 gallons of water, each cup holds 6 oz, and there are 5 rows of 10 chairs. How many ounces of water remain after filling one cup per chair? (1 gallon = 128 oz)","If a cooler starts with 3 gallons of water (128 oz per gallon) and Bill fills 6-ounce cups for 5 rows of 10 chairs, how many ounces of water are left?","Before a conference, Bill fills one 6-ounce cup per chair in a room with 5 rows of 10 seats. The cooler holds 3 gallons (128 oz each). How many ounces remain afterward?",0.8781900405883789
250,"The Reptile House at the zoo has 5 fewer animals than 3 times the number of animals housed in the Rain Forest exhibit. If the Reptile House has 16 animals, how many are in the Rain Forest exhibit?","At the zoo, the Reptile House has 5 fewer animals than three times those in the Rain Forest. If there are 16 reptiles, how many animals are in the Rain Forest exhibit?","If the Reptile House has 16 animals and that’s 5 fewer than three times the Rain Forest’s count, how many animals are in the Rain Forest exhibit?","During a zoo tour, a guide mentions the Reptile House holds 16 animals—5 fewer than 3 times the number in the Rain Forest exhibit. How many animals live in the Rain Forest?",0.9094310204188029
251,"Lauren sent 65 pieces of mail on Monday, 10 more pieces of mail on Tuesday than on Monday, 5 fewer on Wednesday than on Tuesday, and 15 more pieces of mail on Thursday than on Wednesday. How many pieces of mail did Lauren send?","Lauren mailed 65 letters on Monday, 10 more on Tuesday than Monday, 5 fewer on Wednesday than Tuesday, and 15 more on Thursday than Wednesday. How many total letters did she send?","If Lauren sent 65 pieces on Monday, then 10 more on Tuesday, 5 fewer on Wednesday, and 15 more on Thursday, what’s the total number she mailed?","During a busy workweek, Lauren sent 65 mail pieces on Monday, 10 more on Tuesday, 5 fewer on Wednesday, and 15 more on Thursday. How many in total did she mail?",0.8806811471780142
252,"Rocco stores his coins in piles of 10 coins each. He has 4 piles of quarters, 6 piles of dimes, 9 piles of nickels, and 5 piles of pennies. How much money does Rocco have?","Rocco keeps his coins in stacks of 10 each: 4 stacks of quarters, 6 of dimes, 9 of nickels, and 5 of pennies. What is the total value of his coins?","If each pile has 10 coins and Rocco has 4 piles of quarters, 6 piles of dimes, 9 piles of nickels, and 5 piles of pennies, how much money is that altogether?","In his coin collection box, Rocco arranged 10 coins per pile: 4 of quarters, 6 of dimes, 9 of nickels, and 5 of pennies. What’s the total amount of money he owns?",0.8979798952738444
253,Christine is subbing aquafaba for egg whites in baking. Every 2 tablespoons of aquafaba is equivalent to 1 egg white. She's making 2 angel food cakes that call for 8 egg whites each. How many tablespoons of aquafaba will she need in order not to use egg whites?,"Christine replaces egg whites with aquafaba. Since 2 tablespoons equal 1 egg white, and each of her 2 cakes requires 8 egg whites, how many tablespoons of aquafaba are needed?","If 1 egg white equals 2 tablespoons of aquafaba and each of Christine’s 2 cakes needs 8 egg whites, how many tablespoons will she use in total?","For her vegan dessert recipe, Christine substitutes aquafaba for egg whites. Each of 2 cakes needs 8 egg whites, with 2 tablespoons per egg white. How much aquafaba does she need?",0.9042640229066213
254,"A fan can create an airflow of 10 liters per second. If the fan works for 10 minutes each day, calculate the amount of airflow it will create in one week.","The fan blows air at 10 liters per second. If it runs for 10 minutes daily, how much air does it move in a week?","If the airflow rate is 10 L/s and the fan operates 10 minutes a day, what total airflow does it produce in one week?","In his room, a fan pushes air at 10 liters per second and runs for 10 minutes daily. How many liters of air are circulated after one week?",0.8296690185864767
255,"In the first team, Beth scored 12 while Jan scored 10. In the second team, Judy scored 8 while Angel scored 11. How many more points did the first team get than the second team?",Beth scored 12 and Jan 10 for the first team. Judy scored 8 and Angel 11 for the second team. What’s the difference in total points between the two teams?,"If Beth and Jan score 12 and 10 points respectively, while Judy and Angel score 8 and 11, how many more points does the first team have?","During a small competition, Team 1’s Beth and Jan scored 12 and 10 points, while Team 2’s Judy and Angel scored 8 and 11. How many more points did Team 1 score?",0.9016401867071787
256,Melinda is taking a 1200-mile trip with her family to visit their cousins. How much time will they save if they drive 60 miles an hour instead of 50 miles an hour?,Melinda’s family is driving 1200 miles to visit relatives. How much less time will it take if they go 60 mph instead of 50 mph?,"If Melinda drives 1200 miles and compares travel times at 60 mph versus 50 mph, how much time will she save?","On their family vacation, Melinda’s group drives 1200 miles. If they travel at 60 mph rather than 50 mph, how much driving time do they save?",0.8922098477681478
257,"Martha is grinding a spice paste. She adds 3 tablespoons of ginger, 1 teaspoon of cardamom, 1 teaspoon of mustard, 2 tablespoons of garlic, and four times as much chile powder as mustard. What percentage of the spice paste is ginger, rounded to the nearest integer? (Remember there are three teaspoons per tablespoon.)","Martha makes a spice mix using 3 tbsp of ginger, 1 tsp of cardamom, 1 tsp of mustard, 2 tbsp of garlic, and chile powder equal to 4× the mustard amount. What percent of the mixture is ginger, rounded to the nearest whole number? (1 tbsp = 3 tsp)","If Martha combines 3 tbsp ginger, 1 tsp cardamom, 1 tsp mustard, 2 tbsp garlic, and 4 times the mustard’s amount of chile powder, what percentage is ginger? (3 tsp = 1 tbsp)","While cooking dinner, Martha makes a spice paste using 3 tbsp ginger, 1 tsp cardamom, 1 tsp mustard, 2 tbsp garlic, and 4× mustard’s amount of chile powder. What percent of it is ginger?",0.8958365321159363
258,"Jenna is making a costume for her role in Oliver Twist. She needs to make an overskirt and two petticoats. Each skirt uses a rectangle of material that measures 12 feet by 4 feet. She also needs to make a bodice that uses 2 square feet of material for the shirt and 5 square feet of fabric for each of the sleeves. If the material she uses costs $3 per square foot, how much does she spend on the material in total?","Jenna is sewing a costume with one overskirt and two petticoats. Each skirt uses a 12×4 ft fabric piece. Her bodice requires 2 sq ft for the shirt and 5 sq ft per sleeve. At $3 per sq ft, how much will all the fabric cost?","If each of Jenna’s 3 skirts uses 12×4 ft of fabric, and her bodice needs 2 sq ft for the shirt plus 5 sq ft for each sleeve, how much does the material cost at $3 per sq ft?","For a school play, Jenna makes an outfit with 3 skirts (12×4 ft each) and a bodice using 2 sq ft for the shirt and 5 sq ft per sleeve. At $3 per sq ft, how much does she spend?",0.8728347520033518
259,"UF got into the national championship. For them to get into the championship, they scored a total of 720 points during their previous 24 games. In the championship game, however, their opponent was much stronger than any other team they had previously gone against and they scored 2 points less than half as much as they had previously scored in each of the 24 games. Their opponent only lost by 2 points. How many points did their opponent score?","UF made it to the national championship by scoring 720 total points across 24 games. In the final, they scored 2 fewer than half of their average per game from before. Their opponent lost by 2 points. What was their opponent’s score?","If UF averaged 720 points over 24 games, and in the final scored 2 fewer than half that average, while their opponent lost by 2 points, how many points did the opponent score?","In the championship match, UF scored 2 fewer than half of their previous per-game average (720 points over 24 games). Their rival lost by 2 points. What was the rival’s score?",0.8739861249923706
260,"Karl sells clothing in his store. He sells a T-shirt that costs $5, some pants that cost $4, and some skirts that cost $6, he also sells some refurbished t-shirts that cost half the original price. How much is his total income if he sold two T-shirts, one pair of pants, four skirts, and six refurbished T-shirts?","Karl owns a store selling T-shirts for $5, pants for $4, and skirts for $6. He also sells refurbished T-shirts at half price. If he sells 2 T-shirts, 1 pair of pants, 4 skirts, and 6 refurbished shirts, what’s his total revenue?","If Karl sells T-shirts at $5, pants at $4, skirts at $6, and refurbished T-shirts for half the original price, how much does he make from selling 2 T-shirts, 1 pant, 4 skirts, and 6 refurbished shirts?","At his weekend sale, Karl sells 2 T-shirts ($5 each), 1 pant ($4), 4 skirts ($6 each), and 6 refurbished T-shirts at half price. How much money does he earn in total?",0.8739791810512543
261,Levi and his brother were playing basketball. Levi had scored 8 times and his brother had scored 12 times. Levi was determined to beat his brother by at least 5 baskets. How many more times does Levi have to score in order to reach his goal if his brother scores another 3 times?,"Levi and his brother are playing basketball. Levi has scored 8 baskets, and his brother has 12. Levi wants to surpass his brother by at least 5 baskets. If his brother scores 3 more, how many additional baskets must Levi make to meet his goal?","If Levi has scored 8 times and his brother 12, and his brother will score 3 more, how many extra baskets does Levi need to score to lead by at least 5?","During a weekend basketball game, Levi scores 8 times while his brother scores 12. If his brother makes 3 more baskets, how many must Levi score to end up at least 5 ahead?",0.8780513405799866
262,"The Dow Jones Industrial Average fell 2% today. The Dow ended the day at 8,722. What was the Dow in the morning before the markets opened?","The Dow Jones Industrial Average dropped by 2% today and closed at 8,722. What was its value before the decrease?","If the Dow closed at 8,722 after a 2% drop, what was its value before the fall?","After a rough day on Wall Street, the Dow fell 2% and ended at 8,722 points. What was the index’s value at the start of the day?",0.848336269458135
263,"The average GPA for 6th graders is 93, the 7th graders is 2 more than the 6th graders and the 8th graders average GPA is 91. What is the average GPA for the school?","The 6th grade has an average GPA of 93, the 7th grade’s average is 2 points higher, and the 8th grade’s average is 91. What is the school’s overall average GPA?","If the 6th graders average 93, the 7th graders 2 more, and the 8th graders 91, what is the combined average GPA for all three grades?","At Jefferson Middle School, the average GPAs are 93 for 6th grade, 95 for 7th, and 91 for 8th. What’s the average GPA for the whole school?",0.8217443426450094
