id,original,lexical,syntactic,contextual,Question_ECS
333,"Over several years, Daniel has adopted any stray animals he sees on the side of the road. He now has 2 horses, 5 dogs, 7 cats, 3 turtles, and 1 goat. All of the animals are perfectly healthy. In total, how many legs do his animals have?","Daniel has taken in many stray animals: 2 horses, 5 dogs, 7 cats, 3 turtles, and 1 goat. Altogether, how many legs do his animals have?","If Daniel owns 2 horses, 5 dogs, 7 cats, 3 turtles, and 1 goat, how many legs do all of his animals have in total?","At his small farm, Daniel cares for 2 horses, 5 dogs, 7 cats, 3 turtles, and 1 goat. How many animal legs are there altogether?",0.9073572754859924
334,"Olaf is playing a game with his dad. He scored three times more points than his dad, who scored 7 points. How many points did they score in total?","Olaf scores three times as many points as his dad, who earns 7 points. What’s their total score together?","If Olaf scores three times his dad’s 7 points, what is the total number of points both of them scored?","While playing a board game at home, Olaf scores three times as many points as his dad, who got 7 points. How many points did they score combined?",0.9191476901372274
335,It takes 20 minutes for John to go to the bathroom 8 times. How long would it take to go 6 times?,John spends 20 minutes making 8 bathroom trips. How many minutes would 6 trips take at the same rate?,"If John goes to the bathroom 8 times in 20 minutes, how long will 6 trips take him?","During a silly challenge, John times himself and sees it takes 20 minutes for 8 bathroom visits. How long would 6 visits take at that pace?",0.8886697093645731
336,"Nellie went to a big family party. She played with all the other kids there. She played hide and seek with her 6 sisters and her 8 brothers. Then, she played tag with all 22 of her cousins. How many kids did she play with in all?","At a family party, Nellie plays hide-and-seek with her 6 sisters and 8 brothers, and tag with 22 cousins. How many kids did she play with total?","If Nellie plays with 6 sisters, 8 brothers, and 22 cousins, how many kids does she play with altogether?","During a reunion, Nellie has fun playing with her 6 sisters, 8 brothers, and 22 cousins. How many kids does she play with overall?",0.8878263831138611
337,"Henrietta is repainting her house. The walls in the living room take up 600 square feet. She has three bedrooms. The walls in each bedroom take up 400 square feet. If one gallon of paint can cover 600 square feet, how many gallons of paint does Henrietta need to paint her house?","Henrietta wants to paint her house. Her living room walls cover 600 sq ft, and each of her three bedrooms has 400 sq ft of walls. One gallon covers 600 sq ft. How many gallons does she need?","If Henrietta’s living room has 600 square feet of walls and each of her 3 bedrooms has 400 square feet, and one gallon covers 600 square feet, how many gallons of paint are required?","During her summer project, Henrietta plans to repaint her house: 600 sq ft in the living room and 400 sq ft per bedroom (3 bedrooms). One gallon covers 600 sq ft. How many gallons must she buy?",0.9244834979375204
338,"Mr. Johnson has a prescription with enough pills for 30 days. After four-fifths of the days, he has 12 pills left. How many pills is Mr. Johnson supposed to take a day if he takes the same dose daily?","Mr. Johnson’s medication lasts 30 days. After using it for four-fifths of that time, he still has 12 pills. Assuming he takes the same number each day, how many pills does he take per day?","If Mr. Johnson’s prescription covers 30 days, and after 4/5 of those days he has 12 pills remaining, what is his daily dosage in pills?","After starting a 30-day prescription, Mr. Johnson notices that after four-fifths of the time has passed, he has 12 pills left. How many pills does he take each day?",0.9063886404037476
339,"John decided to start rowing around a square lake. Each side of the lake is 15 miles. Jake can row at twice the speed he can swim. It takes him 20 minutes to swim 1 mile. How long, in hours, does it take to row the lake?","John rows around a square lake with 15-mile sides. He rows twice as fast as he swims, and swimming 1 mile takes 20 minutes. How long, in hours, will rowing the full lake take?","If each side of a square lake is 15 miles, and John rows at twice his swimming speed (1 mile per 20 minutes swimming), how long does it take him to row all the way around in hours?","During a morning workout, John rows around a square lake with 15-mile sides. He rows twice as fast as he swims, and swimming 1 mile takes 20 minutes. How long does rowing the lake take in hours?",0.9170682032903036
340,"Janet is trying to decide whether to quit her job and start freelancing. She works 40 hours a week at both jobs. She get paid $30/hour at her current job, and would get paid $40/hour as a freelancer. However, she'd have to pay an extra $25 a week in FICA taxes plus $400/month in healthcare premiums. How much more would Janet make per month as a freelancer if there are four weeks in a month?","Janet works 40 hours weekly, earning $30/hour now but would earn $40/hour freelancing. Freelancing adds $25 weekly in taxes and $400 monthly for health insurance. With 4 weeks per month, how much more would she earn monthly as a freelancer?","If Janet earns $30/hour for 40 hours weekly at her current job, but would earn $40/hour freelancing while paying $25/week in extra taxes and $400/month in health premiums, how much extra would she make per month (4 weeks)?","While planning her career change, Janet calculates her freelance income. She’d earn $40/hour for 40 weekly hours instead of $30/hour now, but would owe $25/week in taxes and $400/month for insurance. With 4 weeks in a month, how much more would she make monthly?",0.9014581541220347
341,"Hallie is an artist. She wins an art contest, and she receives a $150 prize. She sells 3 of her paintings for $50 each. How much money does she make in total from her art?","Hallie, an artist, wins a $150 prize in an art competition and also sells 3 paintings for $50 apiece. What is her total earnings from her art?","If Hallie receives $150 from winning an art contest and sells 3 paintings for $50 each, how much money does she make in total?","At a local gallery event, Hallie wins $150 in an art contest and sells 3 of her paintings for $50 each. How much money does she earn altogether?",0.9394533932209015
342,"George wants to borrow $100 from a loan shark. The finance fee starts at 5% and doubles every week. If George plans to borrow for 2 weeks, how much in fees will he have to pay?","George borrows $100, with a finance fee that begins at 5% and doubles weekly. After 2 weeks, how much will he owe in total finance fees?","If George borrows $100 at a starting finance fee of 5% that doubles each week, what total fee does he owe after 2 weeks?","At a shady street lender, George borrows $100. The finance fee begins at 5% and doubles weekly. How much in fees will he owe after two weeks?",0.9199209213256836
343,"There are 480 grains of rice in one cup. If half a cup is 8 tablespoons and one tablespoon is 3 teaspoons, how many grains of rice are in a teaspoon?","A cup holds 480 rice grains. Given that half a cup equals 8 tablespoons and each tablespoon equals 3 teaspoons, how many grains of rice are in one teaspoon?","If a full cup contains 480 grains, half a cup equals 8 tablespoons, and 1 tablespoon is 3 teaspoons, how many grains does a teaspoon contain?","While cooking dinner, a chef notes that 1 cup of rice has 480 grains, with half a cup being 8 tablespoons and each tablespoon equal to 3 teaspoons. How many grains fit in a teaspoon?",0.9224234024683634
344,Jerome has 20 classmates on his cell phone contact list. He has half as many out of school friends as classmates on his contact list. He also has his two parents and his sister on his contact list. How many people are on Jerome's contact list?,"Jerome’s contact list includes 20 classmates, half as many friends from outside school, plus his two parents and one sister. How many total contacts does he have?","If Jerome’s phone has 20 classmates, half that number in out-of-school friends, and also his parents and sister, how many contacts does he have in total?","While updating his phone, Jerome finds 20 classmates, half that number of out-of-school friends, and adds his parents and sister. How many total people are saved?",0.8417638937632242
345,"Doris works at the Widget Factory in the packing department. She puts 3 widgets in each carton, which are 4 inches wide, 4 inches long, and 5 inches tall. She then packs those cartons into a shipping box before sending it to the loading bay. The shipping boxes are 20 inches wide, 20 inches long, and 20 inches high. How many widgets get shipped in each shipping box?","At the Widget Factory, Doris packs 3 widgets per carton (4×4×5 inches). She places these cartons into 20×20×20 inch shipping boxes. How many widgets are shipped per box?","If each carton (4×4×5 inches) holds 3 widgets, and a shipping box (20×20×20 inches) is filled with those cartons, how many widgets fit in one shipping box?","In the factory’s shipping area, Doris fills each 20-inch cube box with 4×4×5 inch cartons, each holding 3 widgets. How many widgets are in one shipping box?",0.8918845256169637
346,Each bank teller has 10 rolls of coins. Each roll has 25 coins. How many coins do four bank tellers have in all?,"Each teller keeps 10 rolls of coins, and each roll contains 25 coins. How many coins do 4 tellers have combined?","If a teller has 10 rolls of 25 coins each, how many coins do 4 tellers have together?","At a local bank, every teller has 10 rolls of 25 coins each. With 4 tellers on duty, how many coins are there in total?",0.9108299116293589
347,"Malcolm is trying to find the fastest walk to school and is currently comparing two routes. In the first route, he walks for 6 minutes uphill, walks for twice this amount of time along a path, then finishes the journey in a third of the time it took to walk the first two stages. In the second route, he walks along a flat path for 14 minutes, then finishes the walk in twice this amount of time. In minutes, how much longer was the second route compared with the first?","Malcolm compares two routes to school. On the first, he walks uphill for 6 minutes, twice that time on a path, and a third of the total time to finish. On the second, he walks 14 minutes on a flat path, then twice as long afterward. How many minutes longer is the second route?","If Malcolm’s first route takes 6 minutes uphill, twice that along a path, and another third of that total to finish, while his second route takes 14 minutes flat plus twice that to complete, how much longer is the second route?","Every morning, Malcolm compares two walking routes to school. One involves a 6-minute uphill climb, the other a 14-minute flat walk followed by twice that time. How much longer is the second one?",0.9022381206353506
348,"Mark was caught speeding and the judge wants to make an example out of him. The base fine for speeding is $50 but additional penalties apply in this case. The fine is increased by $2 for every mile per hour Mark was going over the speed limit. He was going 75 miles per hour in a 30 mile per hour zone. The fine is also doubled because he was in a school zone. Finally, the judge makes Mark pay $300 in court costs and he also has to pay his lawyer $80/hour for three hours of work. How much does Mark owe for this speeding ticket?","Mark was fined for speeding. The base fine is $50, plus $2 for each mph over the limit. He drove 75 mph in a 30 mph zone. Because it happened in a school zone, the fine is doubled. He also owes $300 court costs and $80/hour to his lawyer for 3 hours. What is his total payment?","If Mark was going 75 mph in a 30 mph zone, with a $50 base fine plus $2 per mph over the limit, doubled for a school zone, and also pays $300 court costs plus 3 hours of lawyer time at $80/hour, how much does he owe?","After being caught speeding in a school zone, Mark faces a $50 fine plus $2 per mph over 30 mph. Driving 75 mph, plus legal fees ($80/hour × 3) and $300 court costs, how much total does he owe?",0.9142946203549703
349,"A construction company is building 2 apartment buildings with 12 floors each. The apartments are almost ready to sell but all of them need doors to be completed. Each floor has 6 apartments, and each apartment needs 7 doors in total. How many doors does the company need to buy?","A company is constructing 2 apartment buildings with 12 floors each. Every floor has 6 apartments, and each apartment requires 7 doors. How many doors are needed in total?","If there are 2 buildings with 12 floors each, 6 apartments per floor, and 7 doors per apartment, how many doors must be purchased in total?","At a downtown site, a firm is finishing 2 apartment buildings (12 floors each, 6 apartments per floor). Each unit needs 7 doors. How many doors should they buy?",0.9123330314954122
350,"A hurricane is approaching the southern coast of Texas, and a rancher is planning to move 400 head of cattle 60 miles to higher ground to protect them from possible inland flooding that might occur. His animal transport truck holds 20 head of cattle. Traveling at 60 miles per hour, what is the total driving time, in hours, it will take to transport all of his cattle to higher ground?",A rancher must relocate 400 cattle 60 miles to safety. His truck holds 20 cattle and travels 60 mph. How many hours will it take him to move all the cattle?,"If a rancher needs to move 400 cattle 60 miles, using a 20-cattle truck traveling at 60 mph, how many hours of driving will be required to complete the move?","Before a hurricane hits Texas, a rancher drives his 20-cattle truck 60 miles per trip to move 400 cattle. If he drives 60 mph, what’s his total driving time in hours?",0.8698373337586721
351,"There are 30 students in the general study hall and twice as many students in the biology hall as there are in the general study hall. If the number of students in the math hall is 3/5 times as many as the combined total number of students in the general study hall and the biology hall combined, calculate the total number of students in all the halls combined.",The general study hall has 30 students. The biology hall has twice that number. The math hall contains 3/5 of the combined number of students in both the general and biology halls. What is the total number of students in all the halls together?,"If the general hall has 30 students, the biology hall has twice as many, and the math hall has 3/5 of the combined total of those two, how many students are there across all halls?","At a school campus, 30 students are in the general hall. The biology hall holds twice as many, and the math hall holds 3/5 as many as both combined. How many students are there in total?",0.9168626268704733
352,"Jake earns thrice what Jacob does. If Jacob earns $6 per hour, how much does Jake earn in 5 days working 8 hours a day?",Jake earns three times Jacob’s hourly wage. Jacob earns $6 per hour. How much does Jake make after working 8 hours daily for 5 days?,"If Jacob earns $6 an hour and Jake earns three times that rate, what is Jake’s total pay for 5 days of 8-hour shifts?","At their summer jobs, Jacob earns $6/hour while Jake earns three times as much. Working 8 hours a day for 5 days, how much money does Jake make?",0.9151899615923563
353,A YouTube video got 3000 likes and 100 more than half as many dislikes. If the video gets 1000 more dislikes and 0 more likes how many dislikes does the video have?,"A video has 3000 likes and 100 more than half that number in dislikes. If it receives 1000 additional dislikes, how many dislikes will it have then?","If a video has 3000 likes, and dislikes equal half that number plus 100, and it gains 1000 more dislikes, how many dislikes does it now have?","One of the viral YouTube clips received 3000 likes and half that number plus 100 in dislikes. After gaining 1000 more dislikes, what’s its new dislike count?",0.8774614532788595
354,"Ivan has a bird feeder in his yard that holds two cups of birdseed. Every week, he has to refill the emptied feeder. Each cup of birdseed can feed fourteen birds, but Ivan is constantly chasing away a hungry squirrel that steals half a cup of birdseed from the feeder every week. How many birds does Ivan’s bird feeder feed weekly?","Ivan’s bird feeder holds 2 cups of seed. Each cup feeds 14 birds, but a squirrel steals half a cup weekly. How many birds does the feeder feed in a week?","If a feeder holds 2 cups of seed, each cup feeds 14 birds, and a squirrel takes half a cup weekly, how many birds are fed each week?","In his backyard, Ivan fills a 2-cup feeder. Each cup feeds 14 birds, but every week, a squirrel steals half a cup. How many birds does the feeder actually feed per week?",0.9099065661430359
355,John drinks 2 energy drinks. 1 of them is a 12-ounce drink with 250 grams of caffeine. The second drink is 3 times more caffeinated per ounce but only 2 ounces. He then takes a caffeine pill that has as much caffeine as his 2 drinks combined. How much caffeine did he consume?,"John drinks two energy drinks: one is 12 oz with 250 grams of caffeine, and the other is 2 oz but three times stronger per ounce. He also takes a pill equal in caffeine to both drinks together. How much caffeine does he consume in total?","If one 12-ounce drink has 250 grams of caffeine and a second 2-ounce drink has three times that per ounce, plus a pill with the same caffeine as both drinks combined, how much caffeine did John consume?","Before a big workout, John has two energy drinks (12 oz and 2 oz, with 250 grams in the first and triple per ounce in the second) and a pill equal to their total caffeine. How much caffeine does he take in all?",0.9082674483458201
356,"Nick hides 10 chocolates in his closet. His brother Alix hides 3 times as many chocolates than Nick hides. Last night, their mom found and took 5 chocolates from Alix. How many more chocolates does Alix have than Nick?","Nick hides 10 chocolates, and Alix hides 3 times that amount. After their mom takes 5 from Alix, how many chocolates does Alix have more than Nick?","If Nick hides 10 chocolates, Alix hides triple that, and 5 are taken from Alix, how many more chocolates does Alix still have compared to Nick?","In their room, Nick hides 10 chocolates, while Alix hides 3 times that. Their mom finds and removes 5 from Alix’s stash. How many more chocolates does Alix have now?",0.8883847494920095
357,"Rick took off on a road trip for the summer. He traveled to the first destination on his trip, and then from there, he traveled twice the distance to this second destination. The third point on his trip was 40 miles away, which was half the distance he traveled from the beginning to his first destination. The final destination took twice the amount of driving of all the other legs put together. How many miles in total did he travel across all the legs of the trip?","Rick’s summer road trip includes four legs: the first leg, the second twice as long, the third 40 miles (half of the first), and the final twice the total of the first three. What’s his total distance traveled?","If Rick’s second destination is twice the first leg’s distance, the third leg is 40 miles (half of the first), and the last leg equals twice the sum of the previous legs, how many miles did he travel altogether?","During his summer vacation, Rick’s road trip covers a first leg, a second leg twice that, a third leg of 40 miles (half the first), and a final leg twice the total of all others. What’s his total travel distance?",0.893055240313212
358,Olivia pays 4 quarters for chips and 12 quarters for soda. How many dollars does she pay in total?,Olivia buys chips for 4 quarters and soda for 12 quarters. How many dollars does she spend altogether?,"If chips cost 4 quarters and soda costs 12 quarters, how much does Olivia pay in dollars total?","At a vending machine, Olivia buys chips for 4 quarters and soda for 12 quarters. What’s her total cost in dollars?",0.9292602439721426
359,Carrie works for $8 an hour and 35 hours a week at her job. It’s been a month since she started working there. She has saved up all of her money because she wants to buy a bike for $400. How much money will she have left over after she buys her bike?,"Carrie earns $8 per hour and works 35 hours weekly. After a month (4 weeks) of saving, she buys a $400 bike. How much money remains?","If Carrie works 35 hours weekly at $8/hour and has worked for 4 weeks, then buys a $400 bike, how much money does she have left?","At her part-time job, Carrie earns $8 an hour and works 35 hours weekly. After 4 weeks, she buys a $400 bike. How much money will she still have?",0.9474465648333231
360,"A dietitian ate three-fourths of her lunch during her lunch break. If the total amount of food she had prepared for lunch had 40 calories, and the recommended calorie intake by the FDA is 25, how many more calories than the recommended amount did she eat?","A dietitian eats 3/4 of a 40-calorie lunch. If the FDA recommends 25 calories, how many more calories did she consume than recommended?","If a dietitian’s meal has 40 calories and she eats three-fourths of it, and the FDA’s recommendation is 25 calories, how many extra calories does she consume?","During her lunch break at the clinic, a dietitian eats 3/4 of a 40-calorie meal. The FDA suggests 25 calories. How many calories over the recommendation did she eat?",0.8665546377499899
361,"Aniyah has 6 times as many birthday candles as Ambika. If Ambika has four birthday candles, how many birthday candles will they have if they put the birthday candles together and shared them equally between themselves?","Aniyah owns 6 times more birthday candles than Ambika. If Ambika has 4 candles, how many candles will each of them have if they combine their candles and then divide them equally?","If Ambika has 4 birthday candles and Aniyah has 6 times that number, how many candles will each person get after they pool and share them evenly?","During a party, Aniyah has 6 times more birthday candles than Ambika. Ambika owns 4 candles. If they put all the candles together and split them evenly, how many will each get?",0.9252182046572367
362,Lauren wanted to make burgers and fries for dinner. She needed a few things from the grocery store and bought the following: 2 pounds of hamburger meat that was on sale for $3.50 a pound. 1 pack of hamburger buns for $1.50. A head of lettuce for $1.00 and a large 1.5-pound tomato that was priced at $2.00 per pound. She also needed a jar of pickles that cost $2.50 and she had a $1.00 off coupon for that item. How much change would Lauren get back if she paid with a $20 bill?,"Lauren goes shopping for burger ingredients: 2 pounds of hamburger at $3.50 per pound, buns for $1.50, lettuce for $1.00, a 1.5-pound tomato at $2 per pound, and pickles costing $2.50 with a $1 coupon. If she pays with $20, how much change will she receive?","If Lauren buys 2 pounds of meat at $3.50 each, a $1.50 pack of buns, a $1 head of lettuce, a 1.5-pound tomato at $2 per pound, and $2.50 pickles with a $1 discount, what change does she get from $20?","At her local grocery store, Lauren picks up items for dinner — hamburger meat, buns, lettuce, a tomato, and discounted pickles. Paying with $20, how much change will she get?",0.871056079864502
363,Josh gets together with 7 friends. Everyone including him puts 5 dollars into a pot. First place gets 80% of the money. Second and third place split the rest. How much money does third place get?,"Josh and 7 friends each put $5 into a shared pot. The winner takes 80% of the total, and the remaining amount is divided equally between second and third place. How much does third place win?","If Josh and 7 friends each contribute $5, and first place earns 80% of the pot while the remaining is split between second and third, what is third place’s share?","At a friendly game night, Josh and 7 others each add $5 to the prize pot. The top winner gets 80% of it, and second and third share what’s left. How much does the third-place player earn?",0.8674886524677277
364,"Joanna and Jacques had 40 and 60 gumballs, respectively, in their dishes. They then purchased 4 times the number of gumballs they had initially and added these to their dishes. If they decided to put together their gumballs and shared them equally, how many gumballs did each get?","Joanna starts with 40 gumballs, and Jacques has 60. Each buys 4 times their original amount and adds them to their dishes. If they combine and divide evenly, how many gumballs does each person end up with?","If Joanna has 40 gumballs and Jacques 60, and both purchase 4 times their initial numbers, then share all their gumballs equally, how many will each get?","At a candy shop, Joanna and Jacques decide to buy more gumballs—4 times their starting amounts (40 and 60). If they pool them together and split evenly, how many does each have?",0.9124937752882639
365,"Jerry is sweeping up pieces of broken glass in the parking lot. He sweeps up 20 amber pieces, 35 green pieces, and some clear pieces. If the green pieces are 25% of the total glass he sweeps up, how many pieces were clear?","Jerry collects 20 amber, 35 green, and an unknown number of clear glass pieces. If the green pieces make up 25% of the total, how many clear pieces did he gather?","If Jerry has 20 amber and 35 green pieces of glass, and green pieces are one-fourth of the total, how many clear pieces are there?","While cleaning a parking lot, Jerry finds 20 amber, 35 green, and some clear glass shards. If green glass represents 25% of all pieces, how many are clear?",0.8794594407081604
