id,original,lexical,syntactic,contextual,Question_ECS
130,"Belinda’s dog is missing, so she made 200 flyers to distribute around town with the help of her friends. Ryan passed out 42 flyers, Alyssa passed out 67, Scott passed out 51 and Belinda passed out the rest. What percentage of the flyers did Belinda pass out?","Belinda printed 200 missing-dog flyers. Ryan handed out 42, Alyssa 67, and Scott 51. Belinda distributed the remainder. What percent did she hand out herself?","If 200 flyers were made, and Ryan, Alyssa, and Scott handed out 42, 67, and 51 respectively, how many did Belinda distribute, and what percent of the total is that?","After her dog went missing, Belinda and her friends passed out 200 flyers. Ryan gave out 42, Alyssa 67, Scott 51, and Belinda the rest. What percentage did Belinda distribute?",0.8827578127384186
131,"John decides to get a new phone number and it ends up being a recycled number. He used to get 20 text messages a day. Now he is getting 55. Assuming the number of texts his friends send has not changed, how many text messages per week is he getting that are not intended for him?","John gets a new phone number, which turns out to be a recycled one. He used to receive 20 messages daily, but now he gets 55. If his friends still send the same number of texts, how many per week are not meant for him?","If John previously got 20 texts per day and now gets 55 with his new recycled number, assuming his friends send the same amount, how many texts each week are not intended for him?","After switching to a recycled number, John notices an increase from 20 to 55 messages per day. If his friends’ texting habits haven’t changed, how many texts per week are from strangers?",0.9189296861489614
132,"Niles is collecting his book club's annual fees. Each of the six members pays $150/year towards snacks, plus $30 each for six hardcover books and $12 each for six paperback books. How much money does Niles collect in total?","Niles collects annual fees from six book club members. Each pays $150 for snacks, $30 each for six hardcovers, and $12 each for six paperbacks. How much money does he collect altogether?","If six members each pay $150 for snacks, $30 per hardcover for six books, and $12 per paperback for six books, what is the total amount Niles collects?","At the start of the year, Niles gathers membership fees for his book club. Every one of the six members pays $150 for snacks, plus $30 each for six hardcovers and $12 each for six paperbacks. How much does Niles receive in total?",0.9159709016482035
133,"Every day, Sara bakes 10 cakes and puts them in his refrigerator. He does this for 5 days. Carol then comes over and eats 12 of his cakes. If it takes 2 cans of frosting to frost a single cake, how many cans of frosting does Bob need to frost the remaining cakes?","Sara bakes 10 cakes a day for 5 days and stores them. Afterward, Carol eats 12 cakes. If frosting one cake requires 2 cans, how many cans are needed for the cakes left?","If Sara bakes 10 cakes each day for 5 days, Carol eats 12 of them, and each cake needs 2 cans of frosting, how many frosting cans are required for the remaining cakes?","During a baking week, Sara makes 10 cakes per day for 5 days. Later, Carol eats 12 of them. If each cake takes 2 cans of frosting, how many cans will Sara need for what’s left?",0.9452159802118937
134,"Jana is 5 inches taller than Kelly, and Kelly is 3 inches shorter than Jess. If Jess is 72 inches tall, how tall is Jana?","Jana’s height is 5 inches more than Kelly’s, and Kelly is 3 inches less than Jess. If Jess measures 72 inches, what is Jana’s height?","If Jess is 72 inches tall, Kelly is 3 inches shorter than Jess, and Jana is 5 inches taller than Kelly, what is Jana’s height?","At a family reunion, Jess is measured at 72 inches tall. Kelly is 3 inches shorter than Jess, and Jana is 5 inches taller than Kelly. How tall is Jana?",0.9574809273084005
135,Tom Brady is shy of the passing yards record in a season. The current record is 5999 yards. He currently has 4200 yards with 6 games left in the season. How many passing yards per game does he need to average to beat the record?,Tom Brady wants to break the season record of 5999 passing yards. He has 4200 yards so far and 6 games left. How many yards per game must he average to surpass the record?,"If the record is 5999 yards and Tom Brady has 4200 yards after playing most of the season, with 6 games remaining, what average yardage per game does he need to beat the record?","Late in the football season, Tom Brady sits at 4200 passing yards. The all-time record is 5999, and 6 games remain. How many yards per game must he average to break it?",0.9235974450906118
136,"Three baskets A, B and C contain different numbers of differently colored marbles. Basket A contains 4 red marbles and 2 yellow marbles. Basket B contains 6 green marbles and 1 yellow marble. Basket C contains 3 white marbles and 9 yellow marbles. What is the difference between the number of each color of marble in the basket that has the greatest difference?","There are three baskets: A, B, and C. Basket A holds 4 red and 2 yellow marbles, Basket B has 6 green and 1 yellow marble, and Basket C has 3 white and 9 yellow marbles. Find the basket with the largest color difference and state that difference.","If Basket A has 4 red and 2 yellow marbles, Basket B has 6 green and 1 yellow, and Basket C has 3 white and 9 yellow, which basket has the biggest difference between colors, and what is that difference?","At a school fair, three baskets are filled with marbles: A (4 red, 2 yellow), B (6 green, 1 yellow), and C (3 white, 9 yellow). Determine the greatest difference in the count of colors and from which basket.",0.8827921350797018
137,John's car gets 30 mpg. He drives 20 miles to work each way 5 days a week. He also drives another 40 miles a week for leisure travel. How many gallons of gas does he use a week?,"John’s car runs 30 miles per gallon. He commutes 20 miles to work and 20 miles back for 5 days a week, plus 40 extra miles for fun. How many gallons does he use weekly?","If John’s car has a fuel efficiency of 30 miles per gallon, and he drives 20 miles each way to work for 5 days, plus 40 leisure miles per week, how much gas does he use in total each week?","Every week, John commutes to work—20 miles each way, 5 days per week—and also takes 40 miles of leisure drives. His car averages 30 miles per gallon. How many gallons does he use weekly?",0.9021668632825216
138,"John has 2 umbrellas in his house and 1 in the car. If they cost $8 each, how much did he pay in total?","John owns 3 umbrellas in total: 2 at home and 1 in his car. If each umbrella costs $8, what’s the total he spent?","If John keeps 2 umbrellas at home and 1 in his car, and each costs $8, how much money did he spend overall?","On a rainy weekend, John realizes he has 2 umbrellas at home and 1 in his car. Each cost him $8. How much did he pay altogether?",0.936004767815272
139,A farmer has three trucks to carry water to his farm. Each truck uses three tanks with a capacity of 150 liters of water. How many liters of water in total can the farmer carry in his trucks?,"A farmer owns 3 trucks, each equipped with 3 tanks that can hold 150 liters of water each. What is the total water capacity of all the trucks combined?","If each of the farmer’s 3 trucks carries 3 tanks, and each tank holds 150 liters, how many liters of water can he transport in total?","On delivery day, a farmer loads 3 trucks to carry water. Every truck has 3 tanks holding 150 liters each. What total volume of water can the trucks carry?",0.9302948514620463
140,Matt has a peanut plantation that is 500 feet by 500 feet. 1 square foot of peanuts can make 50 grams of peanuts. If it takes 20 grams of peanuts to make 5 grams of peanut butter and 1 kg of peanut butter sells for $10 how much does he make from his plantation?,"Matt’s peanut farm measures 500 feet on each side. Every square foot produces 50 grams of peanuts. If 20 grams of peanuts make 5 grams of peanut butter, and 1 kilogram of peanut butter sells for $10, how much total money does Matt earn?","If Matt’s 500×500-foot peanut field yields 50 grams per square foot, and 20 grams of peanuts produce 5 grams of peanut butter, which sells at $10 per kilogram, how much money does he make from the plantation?","At harvest season, Matt’s 500 ft by 500 ft peanut farm produces 50 grams of peanuts per square foot. With 20 grams of peanuts making 5 grams of peanut butter and each kilogram selling for $10, what’s Matt’s total profit?",0.8976075450579325
141,"Martine has 6 more than twice as many peaches as Benjy. Benjy has one-third as many peaches as Gabrielle. If Martine has 16 peaches, how many does Gabrielle have?","Martine owns 6 more peaches than twice the amount Benjy has. Benjy has one-third of Gabrielle’s peaches. If Martine has 16 peaches, how many peaches does Gabrielle have?","If Martine has 16 peaches, which is 6 more than twice Benjy’s number, and Benjy has one-third the peaches of Gabrielle, how many does Gabrielle own?","At a local market, Martine has 16 peaches — 6 more than double Benjy’s count. Benjy has one-third as many peaches as Gabrielle. How many peaches belong to Gabrielle?",0.9235265851020813
142,"James needs 40 fish to make one sushi roll. He goes to the market and buys 400 fish, but later finds out that 20% of the fish have gone bad and cannot be used. How many sushi rolls did James make with the remaining fish?","James requires 40 fish to prepare a sushi roll. He buys 400 fish, but 20% spoil and can’t be used. How many rolls can he make with the rest?","If James buys 400 fish and 20% of them go bad, leaving only good ones for making sushi rolls that each need 40 fish, how many rolls can he make?","While preparing for a sushi festival, James buys 400 fish. After discovering 20% are spoiled, and needing 40 per roll, how many sushi rolls can he still make?",0.9353068172931671
143,"A local music festival is held every year for three days. The three day attendance this year was 2700 people. The second day was rainy so only half the number of people that showed up the first day showed up the second day. The third day was the finale, so attendance was triple the original day. How many people attended the second day of the festival?","A 3-day music festival drew 2700 attendees in total. Day 2’s turnout was half of Day 1’s, while Day 3 had triple Day 1’s attendance. How many attended on the second day?","If a music festival’s total attendance was 2700, with the second day seeing half as many as the first and the third day attracting three times the first, how many came on the second day?","During this year’s annual 3-day music event, 2700 people attended in all. Rain cut Day 2’s crowd to half of Day 1’s, and Day 3 drew three times as many. How many were there on Day 2?",0.8707302113374075
144,"Kenny plans to mow lawns all summer, and then use the profits to buy video-games and books. He charges $15 per lawn. The video-games are $45 each. The books are $5 each. At the end of the summer he has mowed 35 lawns. There are 5 video-games he really wants, and then he will use the rest for books. How many books can he buy?","Kenny earns $15 for every lawn he mows. After mowing 35 lawns, he wants to buy 5 video games at $45 each and spend the remaining money on $5 books. How many books can he afford?","If Kenny mows 35 lawns at $15 each, spends enough on 5 video games at $45 apiece, and buys books for $5 each with what’s left, how many books will he get?","Over summer break, Kenny mows 35 lawns for $15 each. He’ll buy 5 games at $45 each and use leftover money for $5 books. How many books can he purchase?",0.9279236495494843
145,"A store is comparing their profits throughout the year. They had profits of $1,500 in the first quarter of the year, $3,000 in the third quarter, and $2,000 in the fourth quarter. If their annual profits are $8,000, how much profit, in dollars, did they make in the second quarter?","A store earned $1,500 in Q1, $3,000 in Q3, and $2,000 in Q4. If the total yearly profit is $8,000, how much was made in Q2?","If a store’s yearly profit totals $8,000 and its profits were $1,500 in Q1, $3,000 in Q3, and $2,000 in Q4, what was the Q2 profit?","When reviewing finances, a shop notes $1,500 profit in Q1, $3,000 in Q3, and $2,000 in Q4. If the yearly total is $8,000, how much profit came from Q2?",0.8717003762722015
146,"Andy is running late. School starts at 8:00 AM and it normally takes him 30 minutes to get there, but today he had to stop for 3 minutes each at 4 red lights and wait 10 minutes to get past construction. If he left his house at 7:15, how many minutes late will he be?","Andy left home at 7:15. It usually takes him 30 minutes to reach school, which starts at 8:00 AM, but today he hit 4 red lights (3 minutes each) and waited 10 minutes for construction. How late will he arrive?","If Andy leaves home at 7:15, needs 30 minutes for travel, stops 4 times for 3 minutes each, and waits 10 minutes at construction, and school begins at 8:00, how late is he?","One morning, Andy drives to school but faces delays—4 red lights (3 minutes each) and 10 minutes of construction. School starts at 8:00 AM, and he left at 7:15. How many minutes late will he be?",0.8971483608086904
147,John manages to run 15 mph for his whole 5-mile race. The next fastest guy ran the race in 23 minutes. How many minutes did he win the race by?,John runs a 5-mile race at 15 mph. The runner-up finishes in 23 minutes. By how many minutes does John beat him?,"If John completes a 5-mile race running 15 mph, and the second-place runner finishes in 23 minutes, how many minutes faster is John?","During a 5-mile competition, John maintains a 15 mph pace. The next runner takes 23 minutes. How many minutes did John win by?",0.9320934017499288
148,Bob can shuck 10 oysters in 5 minutes. How many oysters can he shuck in 2 hours?,Bob shucks 10 oysters every 5 minutes. How many can he open in 2 hours?,"If Bob shucks 10 oysters in 5 minutes, how many will he shuck over a 2-hour period?","While preparing for a seafood event, Bob shucks oysters at a rate of 10 per 5 minutes. In 2 hours, how many oysters does he shuck?",0.8658646841843923
149,"Galileo is currently renting a car that costs $20 per month. He is planning to buy a brand new car that costs $30 per month. If Galileo will have to pay for the new car for a year, how much will be the difference if he gets the brand new car instead of renting a car?","Galileo rents a car for $20 a month but plans to buy one costing $30 a month. Over a year, what’s the difference in total cost between buying and renting?","If Galileo’s rental car costs $20 monthly and a new one would cost $30 per month, how much more would he spend in a year by buying the car?","For the next year, Galileo considers replacing his $20-per-month rental with a $30-per-month new car. What’s the total yearly difference in cost?",0.8916298945744833
150,"Juan bought T-shirts for his employees. He bought shirts for men and women. Women's t-shirts are $5 cheaper than men's t-shirts of the same color. His company has 2 sectors, one in white t-shirts and the other in black t-shirts. He paid $20 for white men's t-shirts and $18 for black men's t-shirts. The 2 sectors have the same number of men and women, with a total of 40 employees. How much did he spend total on buying t-shirts?","Juan purchased shirts for 40 employees, half men and half women. Women’s shirts are $5 less than men’s. White men’s shirts cost $20, black men’s $18. How much did he spend altogether?","If Juan’s company has 40 employees, equally divided between men and women, and he buys white men’s shirts for $20, black men’s for $18, with women’s shirts $5 cheaper in each color, how much does he pay in total?","At his company, Juan orders uniforms for 40 employees split evenly by gender. The white men’s shirts are $20, black men’s $18, and women’s are $5 cheaper each. How much did he spend in total?",0.9057596027851105
151,"In a single day, it rained for many hours. From 2pm to 4pm, it rained at a rate of 4 inches per hour. From 4pm to 7pm, it rained at a rate of 3 inches per hour. And from 7pm to 9pm, it rained at a rate of 0.5 inches per hour. If the rain gauge started out the day already containing 2 inches of rainwater, how many inches of water will the gauge contain at 9pm?","During one rainy day, it poured from 2pm to 4pm at 4 inches per hour, from 4pm to 7pm at 3 inches per hour, and from 7pm to 9pm at 0.5 inches per hour. If the rain gauge began with 2 inches of water, how much water will it hold by 9pm?","If a rain gauge starts with 2 inches of water, and it rains at 4 inches/hour from 2–4pm, 3 inches/hour from 4–7pm, and 0.5 inches/hour from 7–9pm, how many inches will be in the gauge at 9pm?","On a stormy day, the rain gauge already had 2 inches of water before rainfall began. Between 2–4pm, it rained at 4 inches/hour, between 4–7pm at 3 inches/hour, and from 7–9pm at 0.5 inches/hour. What’s the total water level at 9pm?",0.86096719900767
152,Aunt Angela has 70 jellybeans in a jar. She wants to divide them equally and give them to her 3 nephews and 2 nieces. How many jellybeans did each nephew or niece receive?,Aunt Angela owns a jar with 70 jellybeans and plans to split them evenly among her 3 nephews and 2 nieces. How many jellybeans does each child get?,"If Aunt Angela has 70 jellybeans and distributes them evenly to 3 nephews and 2 nieces, how many jellybeans does each one receive?","At a family picnic, Aunt Angela brings 70 jellybeans to share equally among 3 nephews and 2 nieces. How many does each person get?",0.927451898654302
153,"Peter has four horses. Each one eats 4 pounds of oats, twice a day, and 3 pounds of grain once a day. How many pounds of food does he need to feed his horses for 3 days?",Peter owns 4 horses. Every horse eats 4 pounds of oats twice daily and 3 pounds of grain once daily. How much total food is needed for 3 days?,"If Peter’s 4 horses each eat 4 pounds of oats twice a day and 3 pounds of grain once daily, how many pounds of food does he need for 3 days?","On his farm, Peter feeds 4 horses, giving each 4 pounds of oats twice per day and 3 pounds of grain once per day. Over 3 days, how much total food will they consume?",0.9467087785402933
154,"Fran's school just instituted a school uniform policy. Each student needs to buy five complete uniforms, each consisting of pants, shirt, tie and socks. The pants cost $20, the shirt costs twice as much as the pants, the tie costs 1/5 as much as the shirt and the socks cost $3/pair. How many dollars will each student need to spend?","Fran’s school now requires uniforms. Each student must purchase 5 full sets consisting of pants ($20), shirts (double the price of pants), ties (1/5 the shirt’s cost), and socks ($3). How much must each student spend?","If a full uniform has pants for $20, shirts at twice that price, ties costing one-fifth of the shirt, and socks for $3, and each student needs 5 sets, what’s the total cost per student?","At the start of the term, Fran’s school introduces uniforms. Each student must buy 5 full sets — pants ($20), shirts (twice that), ties (1/5 of the shirt’s cost), and socks ($3). How much will one student spend in total?",0.8869737784067789
155,Scott runs 3 miles every Monday through Wednesday. Then he runs twice as far he ran on Monday every Thursday and Friday. How many miles will he run in a month with 4 weeks?,"Scott runs 3 miles on Monday, Tuesday, and Wednesday each week, and twice that distance on Thursday and Friday. Over 4 weeks, how far does he run?","If Scott runs 3 miles per day Monday–Wednesday and twice that on Thursday and Friday, how many miles will he cover in 4 weeks?","During his 4-week training plan, Scott jogs 3 miles every Monday through Wednesday, and twice that on Thursdays and Fridays. What’s his total distance for the month?",0.8656174937884012
156,"Helen cuts her lawn starting in March and finishes in October. Her lawn mower uses 2 gallons of gas every 4th time she cuts her lawn. For March, April, September and October, she only cuts her law 2 times per month. In May, June, July and August, she has to cut her lawn 4 times per month. How many gallons of gas will she need to cut her lawn from March through October?","Helen mows her lawn from March through October. The mower uses 2 gallons every 4th cut. She cuts it twice a month in March, April, September, and October, and 4 times a month from May to August. How many gallons of gas does she need?","If Helen mows twice monthly in March, April, September, and October, and 4 times monthly from May through August, and her mower uses 2 gallons every 4th cut, how much gas is required for the season?","During mowing season, Helen works from March through October. Her mower needs 2 gallons every 4th cut. She mows twice a month in early and late months, and 4 times a month during summer. How many gallons will she use?",0.8905064364274343
157,"Last week, Arman worked 35 hours for 5 days at $10 per hour. This week, he will receive an increase of $0.5 per hour if he can work for 40 hours. Suppose he can work for 40 hours this week, how much will Arman receive for working two weeks?","Arman worked 35 hours last week at $10/hour. This week he’ll get a $0.50/hour raise and work 40 hours. If he completes those 40 hours, what’s his total pay for the two weeks?","If Arman earns $10/hour for 35 hours in week one and $10.50/hour for 40 hours in week two, how much will he make for both weeks combined?","Over two workweeks, Arman first logs 35 hours at $10/hour, then gets a $0.50 raise for the next week if he works 40 hours. Assuming he does, how much does he earn total?",0.8839131196339926
158,"On Monday, Sydney sends 5 texts each to Allison and Brittney. On Tuesday, she sends 15 texts to each of them. In total, how many texts did Sydney send to Allison and Brittney on both days?","Sydney sent 5 texts each to Allison and Brittney on Monday, and 15 each on Tuesday. How many total texts did she send to both friends over the two days?","If Sydney sends 5 texts each to Allison and Brittney on Monday and 15 each on Tuesday, what’s the total number of texts sent over both days?","At the start of the week, Sydney messages her friends: 5 texts each on Monday and 15 each on Tuesday to Allison and Brittney. How many texts did she send altogether?",0.9088591635227203
159,"Bertha plays tennis. Every ten games, one of her tennis balls wears out. Every five games, she loses a ball. Every four games, she buys a canister of three balls. She started with two balls and gave one to her partner. After twenty games, how many tennis balls does she have?","Bertha begins with 2 tennis balls, giving one to her partner. Every 10 games, a ball wears out; every 5 games, she loses one; and every 4 games, she buys 3 new balls. After 20 games, how many balls remain with her?","If Bertha starts with 2 balls, gives one away, loses a ball every 5 games, wears one out every 10, and buys 3 every 4 games, how many does she have after 20 games?","At her local tennis club, Bertha starts with 2 balls and gives one to her partner. She wears one out every 10 games, loses one every 5 games, and buys 3 new ones every 4 games. After 20 games, how many are left?",0.8872549533843994
160,Dennis collected 10 rocks. He put all of them in his aquarium but his fish ate half of them. He was able to make the fish spit two out. How many of Dennis's rocks are left?,Dennis found 10 rocks and placed them in his aquarium. His fish ate half but later spat out 2. How many rocks does Dennis have left?,"If Dennis has 10 rocks, his fish eat half and then spit 2 back out, how many rocks remain?","While decorating his aquarium, Dennis adds 10 rocks. The fish eat half but later spit 2 out. How many rocks does he end up with?",0.9156194925308228
161,"Marcus is having a water balloon party. He has 100 balloons. Each balloon holds 3 ounces of water. He can buy 50 ounces of water for $2.5 a bottle. If he walks into the store with 2 $10 bills, how much change will he have after he buys all the water he needs?","Marcus plans a water balloon party with 100 balloons, each holding 3 ounces of water. Bottled water costs $2.5 for 50 ounces. If he starts with two $10 bills, how much change will he have after buying enough water for all balloons?","If Marcus has 100 balloons that each hold 3 ounces of water, and bottled water costs $2.5 per 50 ounces, how much change will he have left from $20 after buying all the water he needs?","For his backyard balloon party, Marcus has 100 balloons (3 ounces each). Bottled water sells for $2.5 per 50 ounces. If he takes $20 to the store, how much money will he have left afterward?",0.9206001261870066
